{
  "schema_version": "1.0.0",
  "request_id": "req-0002",
  "input_ref": "save1.dat",
  "snapshot_id": "snap-0001",
  "snapshot_time": "2026-10-13T19:42:04+08:00",
  "freshness": "stale",
  "last_refresh_error": {
    "code": "INPUT_CHANGED",
    "message": "刷新时读取前后哈希不一致；以下为上一次成功结果",
    "retryable": true
  },
  "report": {
    "schema_version": "1.0.0",
    "tool_version": "0.1.0",
    "parser_profile_id": "sottr-save-family-4mib-v1",
    "metadata_version": "0.1.0",
    "reference_set_version": "1.0.0",
    "input_digest": {
      "compressed_sha256": "aaaaaaaaaaaaaaaaaaaaaaaaaaaaaaaaaaaaaaaaaaaaaaaaaaaaaaaaaaaaaaaa",
      "expanded_sha256": "bbbbbbbbbbbbbbbbbbbbbbbbbbbbbbbbbbbbbbbbbbbbbbbbbbbbbbbbbbbbbbbb",
      "compressed_bytes": 597590,
      "expanded_bytes": 4194304
    },
    "context": {
      "platform": "windows_steam",
      "mode": "campaign",
      "build": null,
      "dlc": null,
      "source": "user_declared",
      "limitations": ["桌面信封夹具：旧快照（刷新失败，旧结果仅供参考）"]
    },
    "capabilities": {
      "container": { "status": "supported", "reason_codes": [] },
      "sections": { "status": "supported", "reason_codes": [] },
      "inventory": { "status": "supported", "reason_codes": [] },
      "counters": { "status": "supported", "reason_codes": [] },
      "reference_difference": { "status": "supported", "reason_codes": [] },
      "location": { "status": "unsupported", "reason_codes": ["LOCATION_UNVERIFIED"] }
    },
    "coverage": {
      "supported_category_ids": ["survival_caches"],
      "reference_category_ids": ["survival_caches"],
      "supported_region_counter_keys": [],
      "unavailable_reason_codes": [],
      "evidence_refs": []
    },
    "observations": {
      "container": {
        "status": "supported",
        "format": "zlib",
        "valid": true,
        "eof": true,
        "compressed_bytes": 597590,
        "expanded_bytes": 4194304,
        "trailing_bytes": 0,
        "error": null
      },
      "sections": {
        "status": "supported",
        "valid": true,
        "byte_length": 11892,
        "byte_length_hex": "0x2E74",
        "start_offset": 49108,
        "start_offset_hex": "0xBFD4",
        "section_count": 27,
        "error": null
      },
      "overall_completion": {
        "value": 66.20481872558594,
        "unit": "percent",
        "support_status": "supported",
        "reason": null,
        "evidence_level": "community_correlated",
        "evidence_refs": [],
        "limitations": []
      },
      "inventory": {
        "status": "supported",
        "inventory_complete": true,
        "completeness_scope": "parser_profile 表恢复完整",
        "records": [],
        "record_count": 0,
        "unique_id_count": 0,
        "duplicate_record_count": 0
      },
      "region_counters": []
    },
    "assessments": [],
    "locations": [],
    "evidence": [],
    "diagnostics": []
  },
  "error": null
}
